{
  "$schema": "../../cmake/nco-rules-json-schema.json",
  "section": "Game.Map",
  "ini_comment": "Building placement rules and tiberium behavior",
  "comment": "Building placement rules and tiberium behavior.",
  "rules": [
    {
      "name": "PreventBuildingInShroud",
      "type": "bool",
      "default": true,
      "comment": "Prevent a player from placing a building inside the shroud/fog of war."
    },
    {
      "name": "AllowBuildingBesideWalls",
      "type": "bool",
      "default": true,
      "comment": "Allow building structures off player walls."
    },
    {
      "name": "TiberiumGrows",
      "type": "bool",
      "default": true,
      "comment": "Tiberium cells will grow on the map."
    },
    {
      "name": "TiberiumSpreads",
      "type": "bool",
      "default": true,
      "comment": "Tiberium will spread to nearby cells."
    },
    {
      "name": "SlowTiberiumGrowthAndSpread",
      "type": "bool",
      "default": false,
      "comment": "Slows down tiberium spread and growth (half the default rate)"
    },
    {
      "name": "TiberiumGrowthRate",
      "type": "float",
      "default": 1.0,
      "comment": "Controls the rate of tiberium growth, note enabling `SlowTiberiumGrowthAndSpread` will half the set rate. _Note: excessive values may cause performance problems._"
    },
    {
      "name": "TiberiumSpreadRate",
      "type": "float",
      "default": 1.0,
      "comment": "Controls the rate of tiberium spread, note enabling `SlowTiberiumGrowthAndSpread` will half the set rate. _Note: excessive values may cause performance problems._"
    },
    {
      "name": "TiberiumInfantryDamage",
      "type": "int",
      "default": 2,
      "comment": "The amount of damage infantry takes by walking across a cell of tiberium, if infantry type has the `ImmuneToTiberium` flag is set to `yes` then this is ignored for that type."
    },
    {
      "name": "TiberiumBlossomTreeDamage",
      "type": "int",
      "default": 5,
      "comment": "The amount of damage nearby units/infantry etc. take by when a blossom tree shoots tiberium in the air."
    }
  ]
}
