{
  "$schema": "../../cmake/nco-rules-json-schema.json",
  "section": "Game.House",
  "ini_comment": "House (GDI/NOD) specific behavior, mainly used to hide units/super powers from certain sides",
  "comment": "House (GDI/NOD) specific behavior, mainly used to hide units/super powers from certain sides.",
  "rules": [
    {
      "name": "HideTempleFromGdi",
      "type": "bool",
      "default": true,
      "comment": "Don't allow NOD construction yards captured by GDI to build a NOD Temple"
    },
    {
      "name": "HideObeliskFromGdi",
      "type": "bool",
      "default": true,
      "comment": "Don't allow NOD construction yards captured by GDI to build an Obelisk"
    },
    {
      "name": "HideApcFromNod",
      "type": "bool",
      "default": true,
      "comment": "-"
    },
    {
      "name": "HideRocketLauncherFromNod",
      "type": "bool",
      "default": true,
      "comment": "-"
    },
    {
      "name": "HideHelipadFromNod",
      "type": "bool",
      "default": true,
      "comment": "-"
    },
    {
      "name": "HideAdvancedCommCenterFromNod",
      "type": "bool",
      "default": true,
      "comment": "Don't allow GDI construction yards captured by NOD to to build an Adv. Comm Center"
    },
    {
      "name": "OnlyGdiCanUseIonCannon",
      "type": "bool",
      "default": true,
      "comment": "Only allow GDI constructed Adv. Comm Center to grant the Ion Cannon superpower"
    },
    {
      "name": "OnlyNodCanUseNuke",
      "type": "bool",
      "default": true,
      "comment": "Only allow Nod constructed Temple of Nod to grant the Nuke superpower"
    }
  ]
}
