{
  "$schema": "../../cmake/nco-rules-json-schema.json",
  "section": "Game.Misc",
  "ini_comment": "Miscellaneous rules for game engine behavior",
  "comment": "Rules that don't really fit into one category, covers a wide range of behavior.\n\n- Beta Features (Bibs, 3 point turns)\n- Allow using Skirmish/Multiplayer options in single player\n- Building behaviors",
  "rules": [
    {
      "name": "SmartDefense",
      "type": "bool",
      "default": false,
      "comment": "Human controlled units retaliate when they come under fire and they will also try to crush infantry if possible."
    },
    {
      "name": "TargetTrees",
      "type": "bool",
      "default": false,
      "comment": "Allow units to target trees."
    },
    {
      "name": "McvRedeployable",
      "type": "bool",
      "default": false,
      "comment": "Construction yards can be deconstructed by selecting them and clicking nearby on the map."
    },
    {
      "name": "SpawnVisceroids",
      "type": "bool",
      "default": false,
      "comment": "Spawn visceroids on the map."
    },
    {
      "name": "VehiclesDoThreePointTurns",
      "type": "bool",
      "default": false,
      "comment": "Make wheeled vehicles do 3 point turns."
    },
    {
      "name": "ShowBibsOnBuildings",
      "type": "bool",
      "default": true,
      "comment": "Show little dirt bibs on buildings (if turned off, overrides any rules for individual buildings)"
    },
    {
      "name": "ShowCivilianNames",
      "type": "bool",
      "default": false,
      "comment": "Show names of civilian structures and infantry - (C&C remastered seems to show the names regardless of this switch)"
    },
    {
      "name": "OnlyAllowNukeIfAllPartsHaveBeenCollected",
      "type": "bool",
      "default": true,
      "comment": "Only give the player the nuke at the end of Nod campaign if all crates were collected"
    },
    {
      "name": "OnlyAllowUsingOneNukePerScenario",
      "type": "bool",
      "default": true,
      "comment": "Remove the nuclear superpower after 1 shot"
    },
    {
      "name": "HelipadsAndAircraftBoughtSeparately",
      "type": "bool",
      "default": false,
      "comment": "Helipads do not come with a chopper, they are also cheaper."
    },
    {
      "name": "DestroyedBuildingsHaveSurvivors",
      "type": "bool",
      "default": true,
      "comment": "When a building is destroyed, should there be survivors left behind?"
    }
  ]
}
